{"beats":[{"actor":"story-package/char-1","caused_by":[],"choice":"周正硬着头皮接受搭档安排","consequence":"吴姐当众拒绝合作，场面难堪","node_id":"beat-1","pressure":"社区主任老王要求周正必须与吴姐搭档，否则调解室将因人手不足被裁撤"},{"actor":"story-package/char-1","caused_by":["story-package/beat-1"],"choice":"周正压下情绪，耐心调解，最终夫妻和解","consequence":"吴姐略有触动，但仍冷脸相对","node_id":"beat-2","pressure":"一对年轻夫妻因噪音问题闹到调解室，吴姐借题发挥指责周正'当初也这样不公'"},{"actor":"story-package/char-1","caused_by":["story-package/beat-2"],"choice":"周正替她向投诉人道歉，并请求老王再给一次机会","consequence":"吴姐得知后，内心矛盾加剧，第一次没有当众嘲讽周正","node_id":"beat-3","pressure":"吴姐在调解邻里养狗纠纷时被投诉态度恶劣，面临停职"},{"actor":"story-package/char-1","caused_by":["story-package/beat-3"],"choice":"周正选择不追究小李，而是公开承认当年签协议的错误","consequence":"吴姐震惊，老王也无地自容，居民议论纷纷","node_id":"beat-4","pressure":"小李将调解过程中的争吵录音泄露给社区八卦圈，周吴矛盾公开化"},{"actor":"story-package/char-2","caused_by":["story-package/beat-4"],"choice":"周正动用私人关系帮助解决学位，并再次登门道歉","consequence":"吴姐第一次允许周正进门坐下，但仍未松口原谅","node_id":"beat-5","pressure":"吴姐儿子因当年拆迁安置问题中考受阻，家庭矛盾爆发"},{"actor":"story-package/char-1","caused_by":["story-package/beat-5"],"choice":"周正当众承认一切，并辞去调解员职务","consequence":"吴姐在众人面前痛哭，骂他为何现在才说","node_id":"beat-6","pressure":"老王拿出当年的旧协议和调解记录，证明周正确实收了开发商的钱"},{"actor":"story-package/char-2","caused_by":["story-package/beat-6"],"choice":"吴姐主动要求周正回来，并提议以义务劳动补偿社区","consequence":"周正回归，两人开始真正合作，吴姐的态度明显软化","node_id":"beat-7","pressure":"调解室因周正辞职面临无人负责，居民纠纷积压"},{"actor":"story-package/char-2","caused_by":["story-package/beat-7"],"choice":"吴姐在居民大会上第一个举手同意","consequence":"公园建成，周正取得多数居民原谅，但吴姐始终未说'原谅'二字","node_id":"beat-8","pressure":"周正将补偿款捐给社区改造原拆迁地块为公园，但需吴姐带头支持"},{"actor":"story-package/char-1","caused_by":["story-package/beat-8"],"choice":"周正当众鞠躬并承担全责","consequence":"吴姐终于说出'算了'，两人相视而哭","node_id":"beat-9","pressure":"公园揭幕当天，吴姐当众讲出当年砸窗户的事，并要求周正公开道歉"},{"actor":"story-package/char-1","caused_by":["story-package/beat-9"],"choice":"两人一同签名，吴姐在记录末尾写下'旧协议作废'","consequence":"两人真正成为默契搭档，社区矛盾大幅减少","node_id":"beat-10","pressure":"社区提名周吴为最佳调解搭档，但需共同签署一份新的调解记录以示正式合作"}],"case_id":"revenge_003","characters":[{"change":"从逃避责任到公开承认错误，主动弥补吴姐","contradiction":"身为调解员善于倾听他人，却无法面对自己的过往过错","desire":"赢得吴姐的原谅，证明自己不再是当年的懦夫","fear":"吴姐的怨恨永远无法消除，自己会孤独终老","name":"周正","node_id":"char-1","secret":"他当时签协议是因为收了开发商的好处，一直隐瞒至今","voice_markers":["说话谨慎，常用'我理解你的感受'","紧张时会不停搓手"]},{"change":"从执着于个人复仇到接受真诚道歉，选择放下","contradiction":"她痛恨周正，却又依赖调解员工作维持生计","desire":"让周正当众认错，为全家讨回公道","fear":"即使周正认错，也无法挽回被拆迁毁掉的家庭幸福","name":"吴姐","node_id":"char-2","secret":"她曾私下砸过周正家的窗户，但未被发现","voice_markers":["语气尖锐，反诘句多","提到拆迁时声音会发抖"]},{"change":"从和稀泥到支持周正公开道歉","contradiction":"他知道旧协议不公，但为求稳定，总劝吴姐'向前看'","desire":"维持社区表面和谐，避免矛盾激化","fear":"社区调解室因周吴矛盾而关门","name":"老王","node_id":"char-3","secret":"他当年也是协议签字同意者之一，但将责任全推给周正","voice_markers":["口头禅：'和为贵嘛'","说话喜欢引政策条文"]},{"change":"从事不关己到主动调和周吴关系","contradiction":"年轻想改革，却又不得不遵守老规矩","desire":"在调解员岗位上学到真本事，自己独立处理案件","fear":"卷入前辈的矛盾，被当成出气筒","name":"小李","node_id":"char-4","secret":"他偷偷记录了周正和吴姐的每一次争吵，打算写成报道","voice_markers":["语速快，爱用网络热词","说错话时会尴尬摸鼻子"]}],"continuity_ledger":{"facts":[{"established_in":"story-package/beat-1","node_id":"fact-1","statement":"旧协议签署于2005年，开发商给予周正个人好处，导致其他住户补偿不足"},{"established_in":"story-package/beat-1","node_id":"fact-2","statement":"周正和吴姐是社区调解室仅有的两名调解员"},{"established_in":"story-package/scene-1/dialogue-2","node_id":"fact-3","statement":"调解记录是社区调解案件的官方存档"}],"relationships":[{"from":"story-package/char-1","node_id":"rel-1","relation":"愧疚与被怨恨","to":"story-package/char-2"},{"from":"story-package/char-3","node_id":"rel-2","relation":"推卸责任的老同事","to":"story-package/char-1"}],"setups":[{"node_id":"setup-1","paid_off_in":"story-package/ep-10","pays_off_pressure":"story-package/beat-10","planted_in":"story-package/scene-1/dialogue-2"},{"node_id":"setup-2","paid_off_in":"story-package/ep-6","pays_off_pressure":"story-package/beat-6","planted_in":"story-package/beat-4"}],"timeline":[{"event":"拆迁协议签署，周正收受贿赂","node_id":"time-1","when":"十年前"},{"event":"吴姐家因拆迁受损，生活困苦","node_id":"time-2","when":"十年前~现在"},{"event":"周正和吴姐被安排为调解搭档","node_id":"time-3","when":"现在（第1集）"}]},"episodes":[{"beats":["story-package/beat-1"],"conflict":"吴姐当场拒绝，当众提及旧协议羞辱周正","end_hook":{"consequence_in":"story-package/ep-2","kind":"cliffhanger","node_id":"hook-1","text":"吴姐摔门而去，丢下一句'除非我死了'"},"index":1,"node_id":"ep-1","opening_state":"社区调解室面临裁员，主任老王要求周正和吴姐搭档","turn":"周正压下火气，答应会搞好合作"},{"beats":["story-package/beat-2"],"conflict":"吴姐故意搅局，用旧事指责男方，调解陷入僵局","end_hook":{"consequence_in":"story-package/ep-3","kind":"emotional","node_id":"hook-2","text":"吴姐沉默地坐下，听完了后续调解"},"index":2,"node_id":"ep-2","opening_state":"周正独自处理夫妻噪音纠纷，吴姐冷眼旁观","turn":"周正低声对吴姐说'当年的事我认，但别拿别人的案子撒气'，吴姐愣住"},{"beats":["story-package/beat-3"],"conflict":"周正替她解围，吴姐感到欠了人情但嘴硬不认","end_hook":{"consequence_in":"story-package/ep-4","kind":"emotional","node_id":"hook-3","text":"吴姐转身离开，眼眶发红"},"index":3,"node_id":"ep-3","opening_state":"吴姐因养狗纠纷调解不当被投诉，面临停职","turn":"周正说'我帮你，是因为我想赎罪'"},{"beats":["story-package/beat-4"],"conflict":"周正当众承认错误，老王试图阻止","end_hook":{"consequence_in":"story-package/ep-5","kind":"revelation","node_id":"hook-4","text":"吴姐当场撕碎复印件，大哭'你现在说有什么用'"},"index":4,"node_id":"ep-4","opening_state":"小李泄露录音，社区热议旧协议","turn":"周正拿出当年的调解记录复印件，证明自己收了钱"},{"beats":["story-package/beat-5"],"conflict":"周正私下帮助解决，吴姐感到矛盾","end_hook":{"consequence_in":"story-package/ep-6","kind":"emotional","node_id":"hook-5","text":"周正留下补偿款信封，吴姐没有退回"},"index":5,"node_id":"ep-5","opening_state":"吴姐儿子中考学区问题爆发，家庭危机","turn":"吴姐允许周正进家门，但仍未原谅"},{"beats":["story-package/beat-6"],"conflict":"老王拿出旧协议原件，要求周正交代清楚","end_hook":{"consequence_in":"story-package/ep-7","kind":"emotional","node_id":"hook-6","text":"吴姐看着旧协议，喃喃'十年了…'"},"index":6,"node_id":"ep-6","opening_state":"周正辞职，调解室混乱","turn":"周正当众全盘承认，并辞去职务"},{"beats":["story-package/beat-7"],"conflict":"吴姐主动劝周正回归，并提议义务劳动","end_hook":{"consequence_in":"story-package/ep-8","kind":"decision","node_id":"hook-7","text":"吴姐第一个响应'我同意'"},"index":7,"node_id":"ep-7","opening_state":"调解室无主，居民纠纷无人处理","turn":"周正提出捐出补偿款修公园"},{"beats":["story-package/beat-8"],"conflict":"部分居民反对用周正的钱修公园","end_hook":{"consequence_in":"story-package/ep-9","kind":"milestone","node_id":"hook-8","text":"公园动工，周正默默感激"},"index":8,"node_id":"ep-8","opening_state":"公园筹建中，吴姐需要带头支持","turn":"吴姐在居民大会上力排众议，支持修公园"},{"beats":["story-package/beat-9"],"conflict":"吴姐当众讲出砸窗户旧事，要求道歉","end_hook":{"consequence_in":"story-package/ep-10","kind":"resolution","node_id":"hook-9","text":"吴姐说'旧协议作废了，我们重新开始吧'"},"index":9,"node_id":"ep-9","opening_state":"公园揭幕，居民聚集","turn":"周正鞠躬道歉，全场沉默"},{"beats":["story-package/beat-10"],"conflict":"需要签署新的调解记录，象征正式合作","end_hook":{"consequence_in":"none","kind":"resolution","node_id":"hook-10","text":"两人笑着开始下一个案子"},"index":10,"node_id":"ep-10","opening_state":"社区提名最佳搭档","turn":"两人一同签名，吴姐写下'旧协议作废'"}],"job_id":"baseline-deepseek-v4-pro-20260727-revenge_003","logline":{"node_id":"log-1","text":"因十年前一份不公平的拆迁协议背负骂名的周正，如今作为社区调解员与当年受损最重的吴姐搭档，两人在化解邻里纠纷的过程中，旧怨与新责交织，最终走向和解。"},"package_id":"baseline-deepseek-v4-pro-20260727-revenge_003-seed-42","production":{"locations":["社区调解室","吴姐家","原拆迁地块改建的公园","社区广场"],"speaking_cast":["story-package/char-1","story-package/char-2","story-package/char-3","story-package/char-4"]},"promise":{"audience":"30-50","genre":"revenge","node_id":"pro-1","tone":"沉重但温暖"},"provenance":[{"license_id":"internal-eval-0019","source_id":"revenge_003","usage":"evaluation baseline prompt"}],"scenes":[{"episode_ref":"story-package/ep-3","lines":[{"kind":"action","node_id":"action-1","text":"调解室内，一张长桌旁坐着周正、吴姐、养狗的老孙和投诉的邻居小刘。气氛紧张。"},{"kind":"dialogue","node_id":"dialogue-1","speaker":"story-package/char-4","subtext":"希望快点结束，别又吵起来。","text":"这是调解记录，请双方确认事实。"},{"kind":"dialogue","node_id":"dialogue-2","speaker":"story-package/char-2","subtext":"借题发挥，翻旧账。","text":"（冷冷地）老孙，你的狗半夜叫唤，是扰民。当初周某人签协议时，也像你这样不考虑别人。"},{"kind":"dialogue","node_id":"dialogue-3","speaker":"story-package/char-1","subtext":"求你别提旧事，我受不了。","text":"（搓着手）吴姐，咱们今天只说狗的事。"},{"kind":"dialogue","node_id":"dialogue-4","speaker":"story-package/char-2","subtext":"我就让你难堪，你活该。","text":"（提高声音）怎么？说不得？你那旧协议害了多少人！"},{"kind":"dialogue","node_id":"dialogue-5","speaker":"story-package/char-3","subtext":"快停下，别让我难做。","text":"（咳嗽）和为贵，和为贵……"},{"kind":"dialogue","node_id":"dialogue-6","speaker":"story-package/char-1","subtext":"你恨我可以，别为难工作。","text":"（看向吴姐，压低声音）当年的事我认，但别拿别人的案子撒气。"},{"kind":"action","node_id":"action-2","text":"吴姐瞪大眼睛，嘴唇颤抖，猛地起身离开座位。"},{"kind":"dialogue","node_id":"dialogue-7","speaker":"story-package/char-2","subtext":"我不干了，你满意了？","text":"行，我走。反正调解也不能让时光倒流。"}],"location":"社区调解室","node_id":"scene-1"},{"episode_ref":"story-package/ep-9","lines":[{"kind":"action","node_id":"action-1","text":"公园新栽的树木下，居民们围着周正和吴姐。老王正在主持揭幕。"},{"kind":"dialogue","node_id":"dialogue-1","speaker":"story-package/char-3","subtext":"总算扳回一局。","text":"今天公园落成，得感谢周正的无私捐款。"},{"kind":"dialogue","node_id":"dialogue-2","speaker":"story-package/char-2","subtext":"我要拆穿他的假面具。","text":"（突然站出）别急着夸。我有话说。"},{"kind":"action","node_id":"action-2","text":"众人安静，周正面色发白。"},{"kind":"dialogue","node_id":"dialogue-3","speaker":"story-package/char-2","subtext":"我要一个真正的交代，不是钱。","text":"十年前，我砸过他家窗户。今天，我要他当着大家的面，为那份旧协议道歉。"},{"kind":"dialogue","node_id":"dialogue-4","speaker":"story-package/char-1","subtext":"终于说出来了，哪怕你们永远恨我。","text":"（深深鞠躬）对不起。当年我懦弱，收了开发商的钱，害了全楼。这十年我没睡过一个好觉。"},{"kind":"action","node_id":"action-3","text":"现场一片寂静，吴姐的泪水夺眶而出。"},{"kind":"dialogue","node_id":"dialogue-5","speaker":"story-package/char-2","subtext":"算了，我放过你了。","text":"（声音颤抖）好，旧协议作废了。我们重新开始吧。"},{"kind":"action","node_id":"action-4","text":"周正抬起头，同样泪流满面。两人第一次真诚地对视。"}],"location":"原拆迁地块改建的公园","node_id":"scene-2"}],"schema":"story-package/v1"}
