{"beats":[{"actor":"story-package/character-1","caused_by":[],"choice":"与陈宇争辩后服从，走货梯。","consequence":"订单超时，收到差评和罚款。","node_id":"beat-1","pressure":"订单即将超时，林悦看到客梯即将关门。"},{"actor":"story-package/character-1","caused_by":["story-package/beat-1"],"choice":"不顾阻拦，强行冲向客梯。","consequence":"被陈宇拦下并警告，两人发生激烈争吵。","node_id":"beat-2","pressure":"上次罚款让林悦愤懑，再次来到同一大楼。"},{"actor":"story-package/character-1","caused_by":["story-package/beat-2"],"choice":"脱掉外卖服，穿便装试图混入客梯。","consequence":"被陈宇认出，受到更严厉的处罚威胁。","node_id":"beat-3","pressure":"屡次扣钱后，林悦决定伪装。"},{"actor":"story-package/character-1","caused_by":["story-package/beat-3"],"choice":"不顾一切冲向客梯，陈宇追进去。","consequence":"电梯故障，两人被困在黑暗中。","node_id":"beat-4","pressure":"接到一个高额小费的订单，急需这笔钱。"},{"actor":"story-package/character-2","caused_by":["story-package/beat-4"],"choice":"陈宇坦白弟弟事故的往事。","consequence":"林悦理解他的执着，矛盾缓和。","node_id":"beat-5","pressure":"被困电梯，林悦责备陈宇，密闭空间加剧紧张。"},{"actor":"story-package/character-2","caused_by":["story-package/beat-5"],"choice":"破例允许林悦在人少时使用客梯。","consequence":"林悦感激，两人约定下次的午餐。","node_id":"beat-6","pressure":"电梯获救后，陈宇对林悦产生好感，但职责所在。"},{"actor":"story-package/character-1","caused_by":["story-package/beat-6"],"choice":"全身心投入送单，忽视陈宇。","consequence":"陈宇失落，林悦雨中摔倒。","node_id":"beat-7","pressure":"月度之星评比开始，奖金丰厚，林悦拼尽全力。"},{"actor":"story-package/character-2","caused_by":["story-package/beat-7"],"choice":"放弃执念，帮助林悦并表白心意。","consequence":"两人情感升温。","node_id":"beat-8","pressure":"看到林悦在雨中哭泣，陈宇心疼但规则束缚。"},{"actor":"story-package/character-1","caused_by":["story-package/beat-8"],"choice":"主动到写字楼找陈宇。","consequence":"陈宇临时暂停电梯规则，欢迎她走客梯。","node_id":"beat-9","pressure":"林悦获得月度之星，但感到空虚。"},{"actor":"story-package/character-1","caused_by":["story-package/beat-9"],"choice":"接受彼此，开始约会。","consequence":"浪漫结局，新订单响起。","node_id":"beat-10","pressure":"两人关系确立，未来充满不确定。"}],"case_id":"urban_romance_002","characters":[{"change":"从敌视陈宇到理解并接纳他，学会在规则与人情间找到平衡。","contradiction":"外表急躁，但内心深处渴望被人理解和尊重。","desire":"按时送达订单，赚取稳定收入，摆脱差评罚款的恶性循环。","fear":"因差评和罚款失去这份工作，再次失业。","name":"林悦","node_id":"character-1","secret":"她曾是办公室白领，因公司裁员被迫转行送外卖。","voice_markers":["说话带网络用语","时常抱怨","透露着不服输"]},{"change":"从严格执法到懂得变通，学会体谅他人的不易。","contradiction":"外表刻板不近人情，私下却会帮助老人和小孩。","desire":"维护大楼的安全与秩序，获得上级赏识，证明自己。","fear":"因疏忽导致事故，重演弟弟受伤的悲剧。","name":"陈宇","node_id":"character-2","secret":"因自己疏忽导致弟弟从电梯摔伤，从此对电梯规则产生执念。","voice_markers":["语气严肃","常用规则术语","偶尔流露温柔"]},{"change":"从旁观者到暗中撮合。","contradiction":"表面圆滑，实则有自己的原则。","desire":"做好前台工作，不得罪人，保持愉快环境。","fear":"与人冲突，被卷入麻烦。","name":"孙梅","node_id":"character-3","secret":"她偷偷观察着陈宇和林悦的互动，乐见其成。","voice_markers":["轻声细语","爱调侃"]},{"change":"从嘲笑林悦到尊重她的选择。","contradiction":"看起来油滑，但对朋友讲义气。","desire":"多赚钱，尽快脱离骑手生活。","fear":"一直困在社会底层。","name":"王强","node_id":"character-4","secret":"他多次故意违反电梯规则都没事，因为会讨好保安。","voice_markers":["满嘴跑火车","炫技巧"]}],"continuity_ledger":{"facts":[{"established_in":"story-package/episode-1","node_id":"fact-1","statement":"写字楼有明确的电梯规则：外卖人员需使用货梯，不得使用客梯。"},{"established_in":"story-package/episode-4","node_id":"fact-2","statement":"陈宇的弟弟因电梯事故受伤，因此他对安全规则格外执着。"},{"established_in":"story-package/episode-4","node_id":"fact-3","statement":"林悦曾是白领，被裁员后转行送外卖。"}],"relationships":[{"from":"story-package/character-1","node_id":"relationship-1","relation":"从对立冲突逐渐发展为恋人","to":"story-package/character-2"},{"from":"story-package/character-3","node_id":"relationship-2","relation":"同事，偶尔调侃","to":"story-package/character-2"}],"setups":[{"node_id":"setup-1","paid_off_in":"story-package/episode-4","pays_off_pressure":"story-package/beat-3","planted_in":"story-package/episode-1"},{"node_id":"setup-2","paid_off_in":"story-package/episode-5","pays_off_pressure":"story-package/beat-5","planted_in":"story-package/episode-3"}],"timeline":[{"event":"林悦与陈宇第一次因电梯规则冲突","node_id":"timeline-1","when":"第一集"},{"event":"两人被困电梯，首次敞开心扉","node_id":"timeline-2","when":"第四集"},{"event":"陈宇为林悦暂停电梯规则，两人开始交往","node_id":"timeline-3","when":"第八集"}]},"episodes":[{"beats":["story-package/beat-1"],"conflict":"陈宇依据电梯规则阻拦她使用客梯，两人发生第一次争执。","end_hook":{"consequence_in":"story-package/episode-2","kind":"vow","node_id":"hook-1","text":"林悦发誓下次一定要找陈宇理论。"},"index":1,"node_id":"episode-1","opening_state":"林悦急匆匆进入写字楼，手中的外卖即将超时。","turn":"林悦被迫走货梯，导致订单超时，收到差评和罚款。"},{"beats":["story-package/beat-2"],"conflict":"她试图强行进入客梯，与陈宇爆发更激烈的争吵，引来围观。","end_hook":{"consequence_in":"story-package/episode-3","kind":"decision","node_id":"hook-2","text":"林悦决定换装伪装成白领。"},"index":2,"node_id":"episode-2","opening_state":"林悦再次接到同一大楼的订单，心怀不满。","turn":"孙梅打圆场无效，林悦再次超时，但发现同事王强能轻易混入客梯。"},{"beats":["story-package/beat-3"],"conflict":"她混入客梯时被陈宇认出，陈宇警告再犯将上报，林悦崩溃说出自己的困境。","end_hook":{"consequence_in":"story-package/episode-4","kind":"opportunity","node_id":"hook-3","text":"林悦接到一个特殊订单，备注要求快，可能有大额小费。"},"index":3,"node_id":"episode-3","opening_state":"林悦脱掉外卖服，穿便装试图送餐。","turn":"陈宇内心触动但依然执行，王强安慰林悦。"},{"beats":["story-package/beat-4","story-package/beat-5"],"conflict":"陈宇追进电梯，电梯突发故障，两人被困黑暗狭小空间。","end_hook":{"consequence_in":"story-package/episode-5","kind":"cliffhanger","node_id":"hook-4","text":"维修迟迟未到，电梯内温度升高，林悦出现低血糖症状。"},"index":4,"node_id":"episode-4","opening_state":"林悦为了高额小费订单不顾一切冲向客梯。","turn":"陈宇吐露弟弟事故的秘密，林悦也坦诚自己曾是白领，两人开始理解彼此。"},{"beats":["story-package/beat-5"],"conflict":"陈宇拿出常备糖果给她，两人聊起更多生活和烦恼。","end_hook":{"consequence_in":"story-package/episode-6","kind":"emotional_shift","node_id":"hook-5","text":"林悦送达订单拿到小费，却没有预想的开心，反而一直想着陈宇。"},"index":5,"node_id":"episode-5","opening_state":"继续被困，林悦身体不适。","turn":"电梯恢复运行，门开后两人之间有了微妙变化。"},{"beats":["story-package/beat-6"],"conflict":"陈宇叫住她，破例允许人少时用客梯，两人约定他买饭她送。","end_hook":{"consequence_in":"story-package/episode-7","kind":"new_stakes","node_id":"hook-6","text":"王强告诉林悦月度之星评比即将开始，奖金可观。"},"index":6,"node_id":"episode-6","opening_state":"林悦再次来到大楼，主动走向货梯。","turn":"孙梅看到这一幕调侃陈宇。"},{"beats":["story-package/beat-7","story-package/beat-8"],"conflict":"陈宇几次想找林悦聊天都错过，林悦雨中滑倒订单洒落，无助哭泣。","end_hook":{"consequence_in":"story-package/episode-8","kind":"revelation","node_id":"hook-7","text":"陈宇说出“我想照顾你”，林悦惊讶。"},"index":7,"node_id":"episode-7","opening_state":"林悦为月度之星拼命送单，时间紧张。","turn":"陈宇出现帮她收拾，送她就医并表白。"},{"beats":["story-package/beat-9","story-package/beat-10"],"conflict":"她在客梯前犹豫，陈宇主动按下按钮，说“今天这条电梯规则，由我决定暂停”。","end_hook":{"consequence_in":"none","kind":"resolution","node_id":"hook-8","text":"新订单响起，陈宇说“我等你”。"},"index":8,"node_id":"episode-8","opening_state":"林悦获得月度之星，却主动来到写字楼找陈宇。","turn":"两人走进客梯，相视而笑，上天台聊天。"}],"job_id":"baseline-deepseek-v4-pro-20260727-urban_romance_002","logline":{"node_id":"logline-1","text":"外卖骑手林悦和写字楼保安陈宇为电梯规则反复冲突，一次意外被困电梯，让两人从对立走向理解与相爱。"},"package_id":"baseline-deepseek-v4-pro-20260727-urban_romance_002-seed-42","production":{"locations":["写字楼大厅及电梯区域","电梯内部","写字楼大厅客梯前"],"speaking_cast":["story-package/character-1","story-package/character-2","story-package/character-3","story-package/character-4"]},"promise":{"audience":"22-35","genre":"urban_romance","node_id":"promise-1","tone":"warm, realistic, with light romantic comedy."},"provenance":[{"license_id":"internal-eval-0004","source_id":"urban_romance_002","usage":"evaluation baseline prompt"}],"scenes":[{"episode_ref":"story-package/episode-4","lines":[{"kind":"dialogue","node_id":"dialogue-1","speaker":"story-package/character-1","subtext":"其实我害怕，需要人说话","text":"又是你！要不是你追进来，我们也不会被困在这里！"},{"kind":"dialogue","node_id":"dialogue-2","speaker":"story-package/character-2","subtext":"我不是故意害你，我有苦衷","text":"……对不起。但职责所在。"},{"kind":"dialogue","node_id":"dialogue-3","speaker":"story-package/character-1","subtext":"你根本不知道我的压力","text":"职责？你那该死的电梯规则比我这些单子还重要吗？你知道被差评扣钱是什么滋味吗？"},{"kind":"dialogue","node_id":"dialogue-4","speaker":"story-package/character-2","subtext":"我不想让悲剧重演，请你理解","text":"我弟弟……小时候从电梯摔下去，因为我没看住他。从那以后，我就发誓不能让任何人再因为电梯出事。"},{"kind":"action","node_id":"action-1","text":"林悦沉默了，电梯里的灯光忽明忽暗。"},{"kind":"dialogue","node_id":"dialogue-5","speaker":"story-package/character-1","subtext":"我也不容易，我们其实很像","text":"……我以前是个坐办公室的，裁员后只能送外卖。你以为我想这样横冲直撞吗？"},{"kind":"dialogue","node_id":"dialogue-6","speaker":"story-package/character-2","subtext":"我开始理解你了","text":"对不起，我不知道。"}],"location":"电梯内部","node_id":"scene-1"},{"episode_ref":"story-package/episode-8","lines":[{"kind":"action","node_id":"action-1","text":"林悦站在客梯前，看着墙上的电梯规则告示，犹豫不决。陈宇走过来。"},{"kind":"dialogue","node_id":"dialogue-1","speaker":"story-package/character-2","subtext":"为了你，我可以打破规则","text":"今天这条电梯规则，由我决定暂停。"},{"kind":"action","node_id":"action-2","text":"陈宇按下按钮，客梯门打开。"},{"kind":"dialogue","node_id":"dialogue-2","speaker":"story-package/character-1","subtext":"你真的愿意为我冒这个险？","text":"你确定？不怕丢工作？"},{"kind":"dialogue","node_id":"dialogue-3","speaker":"story-package/character-2","subtext":"我想和你在一起，这比工作重要","text":"规则是死的，人是活的。再说，我也打算换个工作，一份能灵活安排时间的工作。"},{"kind":"dialogue","node_id":"dialogue-4","speaker":"story-package/character-1","subtext":"我喜欢这样的你","text":"原来你也不是那么死板。"},{"kind":"action","node_id":"action-3","text":"两人走进电梯，相视而笑。电梯门缓缓关上。"}],"location":"写字楼大厅客梯前","node_id":"scene-2"}],"schema":"story-package/v1"}
