{"beats":[{"actor":"story-package/char-1","caused_by":[],"choice":"林月亲自去连锁店品尝，确认味道一模一样","consequence":"她震惊发现亡母的手写配方可能被盗","node_id":"beat-1","pressure":"小吃店生意日渐冷清，老顾客提起连锁店味道相似"},{"actor":"story-package/char-1","caused_by":["story-package/beat-1"],"choice":"她隐忍不发，假意应聘店员，暗中观察","consequence":"发现陈芳不知情，只是按总部给的配方操作","node_id":"beat-2","pressure":"林月手持配方去连锁店对峙，遇到店长陈芳"},{"actor":"story-package/char-1","caused_by":["story-package/beat-2"],"choice":"林月不忍，决心告诉陈芳真相","consequence":"陈芳起初不信，两人产生信任危机","node_id":"beat-3","pressure":"陈芳因生意未达预期，被赵经理施压催缴额外费用"},{"actor":"story-package/char-2","caused_by":["story-package/beat-3"],"choice":"陈芳看到赵经理对林月的恶劣态度，选择相信林月","consequence":"两人联手搜集证据，找到老顾客张伯作证","node_id":"beat-4","pressure":"赵经理察觉林月在调查，威胁要关停陈芳的店"},{"actor":"story-package/char-1","caused_by":["story-package/beat-4"],"choice":"林月拿出珍藏的手写配方原件，对比笔迹与连锁店的文件","consequence":"真相大白，赵经理承认偷配方，连锁店败诉","node_id":"beat-5","pressure":"赵经理销毁部分证据，反咬林月诽谤"},{"actor":"story-package/char-1","caused_by":["story-package/beat-5"],"choice":"林月邀请陈芳成为小吃店合伙人，共用配方","consequence":"两家店合并，新店开业，味道传承下去","node_id":"beat-6","pressure":"官司打赢，但陈芳的加盟店面临倒闭"}],"case_id":"revenge_002","characters":[{"change":"从孤独复仇到携手共进，学会放下仇恨，选择正义而非单纯报复","contradiction":"她想报复连锁店，却心软面对同为受害者的单亲妈妈","desire":"守护母亲留下的味道和尊严，讨回公道","fear":"母亲的味道被彻底玷污，小店无法维持","name":"林月","node_id":"char-1","secret":"她保留了母亲手写配方的原件，是唯一证据","voice_markers":["语气坚定，提及母亲时声音柔和","常用短句，行动力强"]},{"change":"从懦弱妥协到勇敢站出来指证，找回自尊","contradiction":"她热爱烹饪却被迫复制别人的配方，内心愧疚","desire":"给女儿稳定生活，让加盟店成功","fear":"投资泡汤，成为母亲失职的人","name":"陈芳","node_id":"char-2","secret":"她早已察觉配方来路不明，但为了生计假装不知","voice_markers":["说话温柔但疲惫","常带歉意，后期变得坚定"]},{"change":"始终未悔改，最终被法律制裁","contradiction":"他表面关心加盟商，实则冷酷算计","desire":"扩张连锁店，赚取更多加盟费","fear":"骗局被揭穿，失去一切","name":"赵经理","node_id":"char-3","secret":"配方是他从林月已故母亲那里偷来的，他认识林母","voice_markers":["说话圆滑，有商业套话","眼神游离"]},{"change":"成为两位母亲沟通的桥梁","contradiction":"孩子却敏锐察觉母亲的忧愁","desire":"帮助妈妈开心","fear":"妈妈不再笑","name":"小宇","node_id":"char-4","secret":"他藏起了林月送的点心，因为太好吃了","voice_markers":["童言无忌","偶尔说出关键真相"]},{"change":"从旁观到主动作证","contradiction":"他怀念过去，却对新店好奇","desire":"吃到正宗的老味道","fear":"记忆中的味道消失","name":"老顾客张伯","node_id":"char-5","secret":"他认识林母，知道配方来历","voice_markers":["说话慢，带方言","总是比较味道"]}],"continuity_ledger":{"facts":[{"established_in":"story-package/scene-1","node_id":"fact-1","statement":"林月母亲留下一道秘密配方，手写在一张纸上。"},{"established_in":"story-package/scene-1/dialogue-6","node_id":"fact-2","statement":"赵经理偷走配方并用于连锁店，还给了陈芳一份笔记本。"},{"established_in":"story-package/ep-2/hook-2","node_id":"fact-3","statement":"陈芳是单亲妈妈，有一个儿子小宇。"}],"relationships":[{"from":"story-package/char-1","node_id":"rel-1","relation":"对手转为合作伙伴，最终成为挚友","to":"story-package/char-2"},{"from":"story-package/char-3","node_id":"rel-2","relation":"窃取配方的人，受害者与原主的关系","to":"story-package/char-1"}],"setups":[{"node_id":"setup-1","paid_off_in":"story-package/scene-1/dialogue-6","pays_off_pressure":"story-package/beat-3","planted_in":"story-package/scene-1/action-1"},{"node_id":"setup-2","paid_off_in":"story-package/ep-7","pays_off_pressure":"story-package/beat-5","planted_in":"story-package/ep-1"}],"timeline":[{"event":"连锁店开业，林月小吃店生意下滑","node_id":"time-1","when":"一个月前"},{"event":"林月确认配方被盗，开始调查","node_id":"time-2","when":"两周前"},{"event":"故事展开至结局","node_id":"time-3","when":"现在"}]},"episodes":[{"beats":["story-package/beat-1"],"conflict":"老顾客张伯说附近新开的连锁店味道很像，林月心生疑惑","end_hook":{"consequence_in":"story-package/ep-2","kind":"cliffhanger","node_id":"hook-1","text":"林月盯着连锁店招牌，攥紧手中的配方"},"index":1,"node_id":"ep-1","opening_state":"林月的小吃店客流稀少，她擦拭着母亲的手写配方相框","turn":"林月亲自去尝，发现配方一模一样，决心调查"},{"beats":["story-package/beat-2"],"conflict":"她发现店长陈芳疲惫而认真，对配方来源一无所知","end_hook":{"consequence_in":"story-package/ep-3","kind":"emotional","node_id":"hook-2","text":"陈芳的女儿小宇跑来店里，林月看到陈芳母亲的一面"},"index":2,"node_id":"ep-2","opening_state":"林月以应聘者身份进入连锁店后厨","turn":"林月决定不立即揭穿，暗中接近陈芳"},{"beats":["story-package/beat-3"],"conflict":"赵经理突然到访，对陈芳施压，林月认出他可能是偷配方的人","end_hook":{"consequence_in":"story-package/ep-4","kind":"decision","node_id":"hook-3","text":"陈芳追出来道歉，林月决定告诉她真相"},"index":3,"node_id":"ep-3","opening_state":"林月与陈芳逐渐熟络，陈芳诉苦总部压榨","turn":"林月忍不住质问赵经理，但被赶出店"},{"beats":["story-package/beat-4"],"conflict":"陈芳怀疑是巧合，两人争执，陈芳甚至让林月离开","end_hook":{"consequence_in":"story-package/ep-5","kind":"revelation","node_id":"hook-4","text":"陈芳从仓库找出笔记本，正是林母的旧物"},"index":4,"node_id":"ep-4","opening_state":"林月向陈芳展示手写配方，讲述母亲的故事","turn":"小宇无意中说出赵经理曾给过妈妈一个笔记本"},{"beats":["story-package/beat-4","story-package/beat-5"],"conflict":"赵经理带人威胁要收回店铺，林月与陈芳合力抵抗","end_hook":{"consequence_in":"story-package/ep-6","kind":"threat","node_id":"hook-5","text":"赵经理察觉，派人毁掉店里的配方记录"},"index":5,"node_id":"ep-5","opening_state":"陈芳完全相信林月，两人计划揭发赵经理","turn":"她们找到老顾客张伯，愿意作证"},{"beats":["story-package/beat-5"],"conflict":"林月拿出母亲留下的另一份手写配方原件，且笔迹独特","end_hook":{"consequence_in":"story-package/ep-7","kind":"moral_choice","node_id":"hook-6","text":"赵经理提出私下和解，林月拒绝"},"index":6,"node_id":"ep-6","opening_state":"店面被破坏，陈芳绝望，林月安慰她还有底牌","turn":"她联系记者和法律援助，准备公开证据"},{"beats":["story-package/beat-5"],"conflict":"赵经理狡辩是林母生前赠送，但张伯作证林母从未外传","end_hook":{"consequence_in":"story-package/ep-8","kind":"suspense","node_id":"hook-7","text":"法官宣布休庭，舆论开始发酵"},"index":7,"node_id":"ep-7","opening_state":"双方对簿公堂，林月呈上配方原件，笔迹鉴定为林母亲笔","turn":"陈芳也站出来指证赵经理欺诈"},{"beats":["story-package/beat-6"],"conflict":"陈芳的店失去品牌授权，面临倒闭","end_hook":{"consequence_in":"story-package/ep-9","kind":"emotional","node_id":"hook-8","text":"陈芳犹豫不决，怕拖累林月"},"index":8,"node_id":"ep-8","opening_state":"判决下达，赵经理和连锁店败诉，需赔偿并停止使用配方","turn":"林月主动邀请陈芳加入自己的店，两人合作"},{"beats":["story-package/beat-6"],"conflict":"开业筹备中，资金紧张，人手不足","end_hook":{"consequence_in":"story-package/ep-10","kind":"hopeful","node_id":"hook-9","text":"开业当天，客人爆满，小宇开心地帮忙"},"index":9,"node_id":"ep-9","opening_state":"林月说服陈芳，两人将两个店面合并成新品牌","turn":"老顾客们闻讯赶来帮忙，社区支持让她们渡过难关"},{"beats":[],"conflict":"赵经理被判刑，但林月收到他的道歉信","end_hook":{"consequence_in":"none","kind":"closure","node_id":"hook-10","text":"林月将手写配方放入新店的传家柜，供人参观"},"index":10,"node_id":"ep-10","opening_state":"新店生意兴隆，林月和陈芳已成为挚友","turn":"林月选择放下仇恨，专注于传承母亲的味道"}],"job_id":"baseline-deepseek-v4-pro-20260727-revenge_002","logline":{"node_id":"log-1","text":"小吃店老板林月发现连锁店盗用亡母留下的手写配方，而加盟店长陈芳是一个被蒙蔽的单亲妈妈，两人从对峙走向联手，揭露连锁骗局，找回尊严与公义。"},"package_id":"baseline-deepseek-v4-pro-20260727-revenge_002-seed-42","production":{"locations":["林月的小吃店","连锁加盟店","新装修的店铺，开业前夜","小吃店傍晚，店内"],"speaking_cast":["story-package/char-1","story-package/char-2","story-package/char-3","story-package/char-4","story-package/char-5"]},"promise":{"audience":"25-45","genre":"revenge","node_id":"prom-1","tone":"现实主义、温情与正义交织"},"provenance":[{"license_id":"internal-eval-0018","source_id":"revenge_002","usage":"evaluation baseline prompt"}],"scenes":[{"episode_ref":"story-package/ep-4","lines":[{"kind":"action","node_id":"action-1","text":"林月从旧木柜中取出一张泛黄的纸，小心翼翼展开，上面是娟秀的手写配方。陈芳站在一旁，神情复杂。"},{"kind":"dialogue","node_id":"dialogue-1","speaker":"story-package/char-1","subtext":"我需要你相信我，这是妈妈留给我的唯一东西。","text":"你看，这是我妈亲手写的。每一个字我都认得。你店里的味道，就是这个配方。"},{"kind":"dialogue","node_id":"dialogue-2","speaker":"story-package/char-2","subtext":"我不想承认自己一直被欺骗，更怕失去现在的一切。","text":"这不能说明什么……也许只是巧合。那道菜很多店都有。"},{"kind":"dialogue","node_id":"dialogue-3","speaker":"story-package/char-1","subtext":"你明明心里清楚，别再逃避了。","text":"巧合？那为什么连我妈的秘密比例——半勺黄酒，三分火候——都一模一样？"},{"kind":"dialogue","node_id":"dialogue-4","speaker":"story-package/char-2","subtext":"我该怎么办？如果这是真的，我就一无所有了。","text":"我……我不知道。赵经理说是他们研发的。我花了全部积蓄……"},{"kind":"action","node_id":"action-2","text":"小宇从门外跑进来，手里举着一个旧笔记本，递给陈芳。"},{"kind":"dialogue","node_id":"dialogue-5","speaker":"story-package/char-4","subtext":"我觉得这个东西对妈妈重要，就藏起来了。","text":"妈妈，这个本子，是上次那个叔叔给的。里面好多画。"},{"kind":"dialogue","node_id":"dialogue-6","speaker":"story-package/char-2","subtext":"天啊，我帮别人偷走了别人的珍宝。","text":"（颤抖翻看）这是……这是林阿姨的笔迹……上面写着“给月儿的秘方”。"},{"kind":"dialogue","node_id":"dialogue-7","speaker":"story-package/char-1","subtext":"终于找到了，妈妈，我会讨回公道。","text":"（泪目）原来它在这里。妈……"}],"location":"小吃店傍晚，店内","node_id":"scene-1"},{"episode_ref":"story-package/ep-9","lines":[{"kind":"action","node_id":"action-1","text":"林月和陈芳在挂招牌，上面写着“月芳小馆”。两人满头大汗，相视而笑。"},{"kind":"dialogue","node_id":"dialogue-1","speaker":"story-package/char-2","subtext":"我害怕再次失败，更怕连累你。","text":"月姐，我还是怕。万一没人来呢？"},{"kind":"dialogue","node_id":"dialogue-2","speaker":"story-package/char-1","subtext":"放下过去，我们一起往前走，这也是妈妈的愿望。","text":"怕什么？我们有最好的配方，还有彼此。我妈说过，做好吃的，心要正。"},{"kind":"dialogue","node_id":"dialogue-3","speaker":"story-package/char-2","subtext":"我终于可以坦然面对一切，不用再低头。","text":"心要正……以前我只想赚钱，现在才懂。谢谢你没放弃我。"},{"kind":"action","node_id":"action-2","text":"张伯和几个老顾客敲门进来，端着自家做的菜，说要帮忙试营业。"},{"kind":"dialogue","node_id":"dialogue-4","speaker":"story-package/char-5","subtext":"社区的味道回来了，我们都会支持你们。","text":"我早就说，林月的手艺是传家宝。现在好了，两个人一起，味道更好了！"},{"kind":"dialogue","node_id":"dialogue-5","speaker":"story-package/char-1","subtext":"妈妈，我们重新开始了。","text":"来，把这张配方挂到墙上。以后大家都能看见，这是我们的起点。"}],"location":"新装修的店铺，开业前夜","node_id":"scene-2"}],"schema":"story-package/v1"}
