{"beats":[{"actor":"story-package/char-2","caused_by":[],"choice":"夫妻决定加大在书房的辅导强度，每晚模拟审核","consequence":"书房使用时间延长，姐姐的个人空间进一步被压缩","node_id":"beat-1","pressure":"入学审核进入倒计时一周，时间紧迫"},{"actor":"story-package/char-4","caused_by":["story-package/beat-1"],"choice":"提出收回书房，要求一周内改回卧室","consequence":"夫妻震惊，家庭气氛骤然紧张","node_id":"beat-2","pressure":"李芳感到个人空间被长期侵占，且约会计划因书房被占而受阻"},{"actor":"story-package/char-1","caused_by":["story-package/beat-2"],"choice":"试图恳求姐姐再宽限两周","consequence":"姐姐感到被忽视，态度更坚决","node_id":"beat-3","pressure":"夫妻面临无处辅导的困境，入学审核只剩三天"},{"actor":"story-package/char-2","caused_by":["story-package/beat-3"],"choice":"张华提出交换房间：夫妻搬到书房，姐姐住回现在的小卧室","consequence":"姐姐犹豫后同意试用，但要求立即行动","node_id":"beat-4","pressure":"矛盾升级，姐姐下最后通牒，且气氛已影响到小杰的情绪"},{"actor":"story-package/char-3","caused_by":["story-package/beat-4"],"choice":"小杰主动提议每天傍晚在客厅大桌上学习，周末再去书房","consequence":"家庭协作模式形成，姐姐看到全家的努力，态度软化","node_id":"beat-5","pressure":"新安排下书房空间局促，辅导效率下降，且姐姐仍感不便"},{"actor":"story-package/char-4","caused_by":["story-package/beat-5"],"choice":"全家一起在客厅进行最后一次模拟审核","consequence":"小杰信心增强，姐姐主动辅导并分享当年经验","node_id":"beat-6","pressure":"入学审核前一天，小杰紧张得失眠"},{"actor":"story-package/char-4","caused_by":["story-package/beat-6"],"choice":"姐姐宣布将书房永久保留为小杰的学习室，自己另租附近公寓","consequence":"夫妻感动落泪，家庭关系升华，所有人得到成长","node_id":"beat-7","pressure":"入学审核当天，小杰表现优秀，但夫妻仍担心未来空间问题"}],"case_id":"family_004","characters":[{"change":"从焦虑讨好到学会信任家人，共同寻找方案","contradiction":"想讨好姐姐保住书房，又不想让儿子失望","desire":"让儿子小杰进入好学校，确保入学审核顺利","fear":"家庭关系因借住矛盾而破裂","name":"李明","node_id":"char-1","secret":"暗地里担心自己作为父亲不够格，无法给儿子最好的","voice_markers":["犹豫时重复“再想想”","说“姐姐”时音调柔软"]},{"change":"从被动忍受到主动沟通，提出双赢解决方案","contradiction":"感激姐姐收留，却又感到空间被剥夺的委屈","desire":"给儿子一个稳定的学习环境，通过入学审核","fear":"寄人篱下失去尊严，被姐姐看轻","name":"张华","node_id":"char-2","secret":"曾悄悄看过出租房源，但害怕搬出去无法负担","voice_markers":["语速快而轻，常带“咱们”","紧张时摆弄衣角"]},{"change":"从依赖父母安排到主动适应，最终理解家人的付出","contradiction":"喜欢书房的学习氛围，但知道那是姑姑的房间","desire":"让父母开心，顺利通过入学审核","fear":"父母因书房的事争吵不休","name":"小杰","node_id":"char-3","secret":"偷偷希望回到自己家，但不敢说出口","voice_markers":["声音稚嫩，爱问“真的吗？”","高兴时会蹦跳"]},{"change":"从犹豫不决到坦诚表达需求，最终找到双赢方案","contradiction":"想支持弟弟，却又觉得无私付出已经太多","desire":"渴望拥有属于自己的私人卧室，重获个人空间","fear":"伤害弟弟一家的感情，被看作自私","name":"李芳","node_id":"char-4","secret":"最近开始约会，需要私人空间，但不好意思直说","voice_markers":["叹气频繁","说“你们”时略带疏离"]}],"continuity_ledger":{"facts":[{"established_in":"story-package/ep-1","node_id":"fact-1","statement":"入学审核在周四上午9点于星海小学进行。"},{"established_in":"story-package/ep-1","node_id":"fact-2","statement":"李芳家有三间房间：主卧、小卧、书房。"},{"established_in":"story-package/ep-3","node_id":"fact-3","statement":"书房原为李芳的卧室，三年前改为书房借给弟弟一家。"}],"relationships":[{"from":"story-package/char-1","node_id":"rel-1","relation":"亲姐弟，李明自幼依赖姐姐","to":"story-package/char-4"},{"from":"story-package/char-2","node_id":"rel-2","relation":"姑嫂，张华尊重姐姐但也怕被看低","to":"story-package/char-4"},{"from":"story-package/char-3","node_id":"rel-3","relation":"姑侄，小杰亲近姑姑但知道不是自己家","to":"story-package/char-4"}],"setups":[{"node_id":"setup-1","paid_off_in":"story-package/scene-2","pays_off_pressure":"story-package/beat-6","planted_in":"story-package/ep-1"},{"node_id":"setup-2","paid_off_in":"story-package/ep-8","pays_off_pressure":"story-package/beat-7","planted_in":"story-package/ep-4"}],"timeline":[{"event":"李芳提出收回书房","node_id":"time-1","when":"入学审核前七天"},{"event":"全家交换房间，书房变为卧室","node_id":"time-2","when":"入学审核前三天"},{"event":"客厅模拟审核，李芳主动辅导","node_id":"time-3","when":"入学审核前一天"},{"event":"小杰通过审核，李芳宣布租房","node_id":"time-4","when":"入学审核当天"}]},"episodes":[{"beats":["story-package/beat-1","story-package/beat-2"],"conflict":"李芳在早餐时突然提出要收回书房，而且理由含糊。","end_hook":{"consequence_in":"story-package/ep-2","kind":"deadline","node_id":"hook-1","text":"李芳放下筷子：“一周后，我需要那个房间彻底清空。”"},"index":1,"node_id":"ep-1","opening_state":"入学审核倒计时七天的早晨，全家人如常忙碌，小杰在书房晨读。","turn":"李明试图用玩笑拖延，但李芳态度认真，给出最后期限为一周。"},{"beats":["story-package/beat-3"],"conflict":"如何在不伤害姐姐感情的前提下保住书房？","end_hook":{"consequence_in":"story-package/ep-3","kind":"cliffhanger","node_id":"hook-2","text":"李明深吸一口气，敲响姐姐的门：“姐，我们谈谈。”"},"index":2,"node_id":"ep-2","opening_state":"夫妻在卧室压低声音争论，小杰在客厅不安地听着。","turn":"张华提出交换房间的主意，但李明担心姐姐不接受。"},{"beats":["story-package/beat-3","story-package/beat-4"],"conflict":"李明的恳求被李芳打断，她吐露自己的孤独和对私人空间的渴望。","end_hook":{"consequence_in":"story-package/ep-4","kind":"suspense","node_id":"hook-3","text":"李芳沉默许久：“给我一晚上考虑。”"},"index":3,"node_id":"ep-3","opening_state":"书房内，堆满书籍和玩具，李芳站在门口，神情疲惫。","turn":"交换方案被提出后，李芳陷入沉思，没有立即拒绝。"},{"beats":["story-package/beat-4","story-package/beat-5"],"conflict":"空间调整后，书房变成夫妻卧室，拥挤不堪，且辅导功能受损。","end_hook":{"consequence_in":"story-package/ep-5","kind":"hope","node_id":"hook-4","text":"小杰拉着妈妈的手：“咱们试试客厅吧，那里有张大桌子。”"},"index":4,"node_id":"ep-4","opening_state":"第二天一早，全家动手搬家具，气氛微妙。","turn":"小杰看到父母的为难，主动提出调整。"},{"beats":["story-package/beat-5"],"conflict":"客厅学习效率低，且李芳的私人时间仍被打乱，她开始焦躁。","end_hook":{"consequence_in":"story-package/ep-6","kind":"revelation","node_id":"hook-5","text":"李芳从房间出来，看着灯下用功的小杰，轻叹：“或许我该帮帮他。”"},"index":5,"node_id":"ep-5","opening_state":"客厅大桌上摊开课本，全家围坐，但时常被电视声干扰。","turn":"李芳意外发现小杰对客厅嘈杂的适应力，并看到全家的团结。"},{"beats":["story-package/beat-6"],"conflict":"小杰缺乏自信，担心面试失败。","end_hook":{"consequence_in":"story-package/ep-7","kind":"affirmation","node_id":"hook-6","text":"李芳合上课本：“你比你爸当年强多了，明天肯定行。”"},"index":6,"node_id":"ep-6","opening_state":"入学审核倒计时最后一天，小杰紧张得吃不下饭。","turn":"李芳主动加入模拟审核，分享自己当年的经历，缓解气氛。"},{"beats":["story-package/beat-7"],"conflict":"审核过程不可见，夫妻焦虑踱步。","end_hook":{"consequence_in":"story-package/ep-8","kind":"surprise","node_id":"hook-7","text":"李芳看着手机短信，忽然宣布：“我有事跟你们说。”"},"index":7,"node_id":"ep-7","opening_state":"入学审核当天早晨，全家送小杰到校门口，紧张等待。","turn":"小杰出来时满脸笑容，但夫妻担心后续空间问题仍未解决。"},{"beats":["story-package/beat-7"],"conflict":"李芳宣布已租下附近公寓，将书房永久留给小杰，令夫妻意外。","end_hook":{"consequence_in":"none","kind":"resolution","node_id":"hook-8","text":"李芳微笑举杯：“我们都需要自己的房间，不是吗？”"},"index":8,"node_id":"ep-8","opening_state":"当晚，一家人聚在客厅庆祝小杰通过入学审核。","turn":"夫妻拒绝，但李芳透露自己需要独立空间开始新感情，这才是双赢。"}],"job_id":"baseline-deepseek-v4-pro-20260727-family_004","logline":{"node_id":"logline-1","text":"一对夫妻为儿子上学借住姐姐家，在入学审核前夕，姐姐需要收回书房，一家人在空间与亲情间寻找平衡。"},"package_id":"baseline-deepseek-v4-pro-20260727-family_004-seed-42","production":{"locations":["书房","学校审核办公室","客厅"],"speaking_cast":["story-package/char-1","story-package/char-2","story-package/char-3","story-package/char-4"]},"promise":{"audience":"25-45","genre":"family","node_id":"promise-1","tone":"warm, realistic"},"provenance":[{"license_id":"internal-eval-0014","source_id":"family_004","usage":"evaluation baseline prompt"}],"scenes":[{"episode_ref":"story-package/ep-3","lines":[{"kind":"dialogue","node_id":"dialogue-1","speaker":"story-package/char-1","subtext":"希望姐姐心软，但又怕显得得寸进尺","text":"姐，再宽限两周行吗？小杰的模拟题还没做完。"},{"kind":"dialogue","node_id":"dialogue-2","speaker":"story-package/char-4","subtext":"我也有需要，不是只为你们活","text":"明子，我不是不通情理。可你看看这屋子，我连个自己的角落都没了。"},{"kind":"dialogue","node_id":"dialogue-3","speaker":"story-package/char-2","subtext":"宁愿自己挤一点，也要保住孩子的学习空间","text":"姐姐，我们真的感激你。要不……我们搬到这里，你回你原来的小卧室？"},{"kind":"dialogue","node_id":"dialogue-4","speaker":"story-package/char-4","subtext":"我不忍心看你们受罪，但真的累了","text":"那你们睡哪儿？这书房堆成这样，床都放不下。"},{"kind":"dialogue","node_id":"dialogue-5","speaker":"story-package/char-1","subtext":"为了儿子，什么牺牲都行，可是也怕姐姐不答应","text":"我们打地铺就行。小杰不能没地方学习。"},{"kind":"action","node_id":"action-1","text":"李芳环视书房，伸手碰了碰小杰的铅笔盒，沉默良久。"},{"kind":"dialogue","node_id":"dialogue-6","speaker":"story-package/char-4","subtext":"我需要想清楚自己到底想要什么","text":"……给我一晚上考虑。"}],"location":"书房","node_id":"scene-1"},{"episode_ref":"story-package/ep-6","lines":[{"kind":"action","node_id":"action-2","text":"大桌上摊着“入学审核”模拟试卷，小杰坐着，三面围坐着家人。"},{"kind":"dialogue","node_id":"dialogue-7","speaker":"story-package/char-2","subtext":"用角色扮演帮孩子放松，也暗示姐姐的参与很重要","text":"来，最后一遍‘入学审核’模拟，姑姑当老师，咱们开始。"},{"kind":"dialogue","node_id":"dialogue-8","speaker":"story-package/char-4","subtext":"她问的其实是多年前问自己的问题","text":"好，小杰，回答我：为什么想上这所学校？"},{"kind":"dialogue","node_id":"dialogue-9","speaker":"story-package/char-3","subtext":"他真正喜欢的是家人陪他一起读书的感觉","text":"因为……这里有很多书，还有大大的操场。"},{"kind":"dialogue","node_id":"dialogue-10","speaker":"story-package/char-4","subtext":"试探孩子对书房变动的真实感受","text":"那你觉得最好的学习地方是哪儿？"},{"kind":"dialogue","node_id":"dialogue-11","speaker":"story-package/char-3","subtext":"孩子需要的是家人的关注，而非具体的房间","text":"客厅！这样你们都能看见我。"},{"kind":"action","node_id":"action-3","text":"李芳怔了怔，与李明、张华对视，眼眶微红。"},{"kind":"dialogue","node_id":"dialogue-12","speaker":"story-package/char-4","subtext":"她释怀了，决定无论空间如何，都会支持到底","text":"你比你爸当年强多了，明天肯定行。"}],"location":"客厅","node_id":"scene-2"}],"schema":"story-package/v1"}
