{"beats":[{"actor":"story-package/char-1","caused_by":[],"choice":"李大山找王老根商量","consequence":"王老根提出要东村让出戏台一年","node_id":"beat-1","pressure":"东村需要戏班，西村却只有一天能凑齐"},{"actor":"story-package/char-1","caused_by":["story-package/beat-1"],"choice":"李大山决定另找戏班","consequence":"四处碰壁，找不到替代","node_id":"beat-2","pressure":"李大山拒绝让戏台，冲突升级"},{"actor":"story-package/char-3","caused_by":[],"choice":"赵师傅挽留小桃，小桃犹豫","consequence":"小桃暂时留下，但心不在","node_id":"beat-3","pressure":"西村戏班内部，小桃要进城"},{"actor":"story-package/char-5","caused_by":["story-package/beat-2"],"choice":"阿强私下联系小桃，想创新","consequence":"两人开始策划新式庙会节目","node_id":"beat-4","pressure":"阿强提议放电影代替，被李大山骂"},{"actor":"story-package/char-6","caused_by":["story-package/beat-1","story-package/beat-2"],"choice":"李大山和王老根都受触动","consequence":"双方态度软化，但未让步","node_id":"beat-5","pressure":"老庙祝讲古，警示轮办旧例不能断"},{"actor":"story-package/char-2","caused_by":["story-package/beat-3"],"choice":"王老根面对女儿质问，坦白","consequence":"父女关系紧张，但也解开了心结","node_id":"beat-6","pressure":"小桃身世秘密意外泄露"},{"actor":"story-package/char-1","caused_by":["story-package/beat-5","story-package/beat-4"],"choice":"李大山放下身段，再找王老根","consequence":"提出共办庙会，打破旧例","node_id":"beat-7","pressure":"庙会日期临近，东村仍无着落"},{"actor":"story-package/char-4","caused_by":["story-package/beat-7"],"choice":"小桃说服戏班众人支持合作","consequence":"戏班同意共办，王老根点头","node_id":"beat-8","pressure":"王老根犹豫不决，顾虑面子"},{"actor":"story-package/char-3","caused_by":["story-package/beat-8"],"choice":"赵师傅收阿强为徒，传新戏","consequence":"结合电子音乐，创出老戏新唱","node_id":"beat-9","pressure":"戏班需准备新节目"},{"actor":"story-package/char-5","caused_by":["story-package/beat-9"],"choice":"两人坦诚交流，化解矛盾","consequence":"感情加深，合作更默契","node_id":"beat-10","pressure":"彩排时阿强和小桃因形式产生分歧"},{"actor":"story-package/char-1","caused_by":["story-package/beat-10"],"choice":"两村村民齐心协力","consequence":"演出大获成功，轮办旧例升级为共办","node_id":"beat-11","pressure":"庙会当天，老戏台上下紧张"}],"case_id":"rural_003","characters":[{"change":"从固执到学会合作","contradiction":"坚持轮办旧例，却又不得不求西村","desire":"顺利办成庙会，挣足面子","fear":"被西村看扁，丢祖宗脸","name":"李大山","node_id":"char-1","secret":"年轻时欠王老根一个人情","voice_markers":["爱说老规矩","说话带方言腔"]},{"change":"从计较到坦诚","contradiction":"想拿捏东村，又怕坏了乡情","desire":"保住戏班，为西村争利益","fear":"戏班散了，传统没了","name":"王老根","node_id":"char-2","secret":"戏班青衣小桃是他私生女","voice_markers":["精明","话中有话"]},{"change":"收下徒弟，放下执念","contradiction":"恪守旧规，却不得不变通","desire":"戏班传承有人","fear":"自己身体垮了，手艺失传","name":"赵师傅","node_id":"char-3","secret":"已不能唱主角","voice_markers":["严肃","爱哼戏文"]},{"change":"找到传承与发展的平衡","contradiction":"热爱唱戏，又向往城市","desire":"进城见世面","fear":"一辈子困在农村","name":"小桃","node_id":"char-4","secret":"是王老根私生女","voice_markers":["年轻直接","偶尔哀怨"]},{"change":"学会理解传统，勇敢表达","contradiction":"孝顺与革新","desire":"用新方式办好庙会","fear":"被父亲压制","name":"阿强","node_id":"char-5","secret":"暗恋小桃","voice_markers":["新潮观点","敢想敢说"]},{"change":"看到希望","contradiction":"中立却总想调和","desire":"守住戏台，记住根","fear":"戏台荒废","name":"老庙祝","node_id":"char-6","secret":"知道王老根秘密","voice_markers":["慢悠悠","总讲古"]}],"continuity_ledger":{"facts":[{"established_in":"story-package/ep-1","node_id":"fact-1","statement":"东村和西村共用一座老戏台，按轮办旧例每年轮流主办庙会。"},{"established_in":"story-package/ep-1","node_id":"fact-2","statement":"西村戏班只有庙会当天能凑齐人，因演员要外出打工。"},{"established_in":"story-package/ep-4","node_id":"fact-3","statement":"小桃是王老根的私生女。"},{"established_in":"story-package/ep-2","node_id":"fact-4","statement":"赵师傅身体已不能唱主角。"}],"relationships":[{"from":"story-package/char-1","node_id":"rel-1","relation":"既是乡邻又是较量对手，表面和气暗地较劲","to":"story-package/char-2"},{"from":"story-package/char-4","node_id":"rel-2","relation":"私生父女，长期隐瞒，关系紧绷","to":"story-package/char-2"},{"from":"story-package/char-5","node_id":"rel-3","relation":"暗恋与惺惺相惜，因创新走近","to":"story-package/char-4"},{"from":"story-package/char-6","node_id":"rel-4","relation":"被尊重的长者，点醒大山","to":"story-package/char-1"}],"setups":[{"node_id":"setup-1","paid_off_in":"story-package/beat-6","pays_off_pressure":"story-package/beat-6","planted_in":"story-package/beat-3"},{"node_id":"setup-2","paid_off_in":"story-package/beat-7","pays_off_pressure":"story-package/beat-7","planted_in":"story-package/beat-1"},{"node_id":"setup-3","paid_off_in":"story-package/beat-9","pays_off_pressure":"story-package/beat-9","planted_in":"story-package/beat-4"}],"timeline":[{"event":"东村得知戏班只有当天得空，李大山找王老根被拒。","node_id":"tl-1","when":"第一天"},{"event":"李大山托人找其他戏班无果，小桃欲离村，阿强联络小桃。","node_id":"tl-2","when":"第二天"},{"event":"老庙祝讲古，小桃身世泄露，王老根坦白。","node_id":"tl-3","when":"第三天"},{"event":"李大山再找王老根提共办，戏班同意。","node_id":"tl-4","when":"第四天"},{"event":"赵师傅收阿强为徒，排练新戏，阿强与小桃化解分歧。","node_id":"tl-5","when":"第五天至庙会前一日"},{"event":"演出成功，轮办旧例升级为共办新俗。","node_id":"tl-6","when":"庙会当日"}]},"episodes":[{"beats":["story-package/beat-1"],"conflict":"李大山硬着头皮去找王老根，王老根端架子","end_hook":{"consequence_in":"story-package/beat-2","kind":"question","node_id":"hook-1","text":"李大山会答应吗？老戏台归谁？"},"index":1,"node_id":"ep-1","opening_state":"东村准备庙会，发现西村戏班只有当天得空","turn":"王老根提出要东村让出戏台一年的条件"},{"beats":["story-package/beat-2","story-package/beat-3"],"conflict":"李大山尝试找其他戏班，阿强提议被否","end_hook":{"consequence_in":"story-package/beat-3","kind":"emotional_cliffhanger","node_id":"hook-2","text":"小桃能否留下？戏班会散吗？"},"index":2,"node_id":"ep-2","opening_state":"李大山拒绝条件，两村僵持","turn":"小桃欲离村，赵师傅苦留"},{"beats":["story-package/beat-4","story-package/beat-5"],"conflict":"阿强私联小桃，两人策划新招","end_hook":{"consequence_in":"story-package/beat-5","kind":"question","node_id":"hook-3","text":"老规矩能破吗？"},"index":3,"node_id":"ep-3","opening_state":"东村四处碰壁，西村内部不稳","turn":"老庙祝出面，讲述老戏台历史与轮办旧例由来"},{"beats":["story-package/beat-6"],"conflict":"小桃身世意外暴露，王老根与女儿冲突","end_hook":{"consequence_in":"story-package/beat-6","kind":"revelation","node_id":"hook-4","text":"秘密公开后，王老根如何面对？"},"index":4,"node_id":"ep-4","opening_state":"两村被旧例触动，但面子上过不去","turn":"王老根坦白，父女裂痕加深"},{"beats":["story-package/beat-7"],"conflict":"他再次找王老根，提出共办庙会","end_hook":{"consequence_in":"story-package/beat-8","kind":"question","node_id":"hook-5","text":"王老根会同意吗？"},"index":5,"node_id":"ep-5","opening_state":"李大山受庙祝启发，想和解","turn":"王老根犹豫，小桃带领戏班支持"},{"beats":["story-package/beat-8","story-package/beat-9"],"conflict":"赵师傅传统与新潮碰撞","end_hook":{"consequence_in":"story-package/beat-9","kind":"challenge","node_id":"hook-6","text":"老戏新唱能成吗？"},"index":6,"node_id":"ep-6","opening_state":"两村敲定共办，但节目要新","turn":"赵师傅收阿强为徒，融合新元素"},{"beats":["story-package/beat-10"],"conflict":"阿强和小桃感情升温，但演出压力大","end_hook":{"consequence_in":"story-package/beat-11","kind":"anticipation","node_id":"hook-7","text":"明天庙会能顺利吗？"},"index":7,"node_id":"ep-7","opening_state":"庙会前夕，彩排遇到困难","turn":"两人坦诚化解分歧，众人齐心协力"},{"beats":["story-package/beat-11"],"conflict":"两村村民将信将疑，等待新式演出","end_hook":{"consequence_in":"none","kind":"resolution","node_id":"hook-8","text":"轮办旧例从此变了模样，老戏台迎来新生。"},"index":8,"node_id":"ep-8","opening_state":"庙会当天，老戏台前热闹非凡","turn":"演出获满堂彩，老戏新唱震撼全场"}],"job_id":"baseline-deepseek-v4-pro-20260727-rural_003","logline":{"node_id":"log-1","text":"两村共用老戏台，今年庙会轮到东村，可西村戏班只有那一天能凑齐，一场关于传统与情面的考验在老戏台前拉开。"},"package_id":"baseline-deepseek-v4-pro-20260727-rural_003-seed-42","production":{"locations":["老戏台","东村庙会广场","西村戏班排练棚","老庙祝家"],"speaking_cast":["story-package/char-1","story-package/char-2","story-package/char-3","story-package/char-4","story-package/char-5","story-package/char-6"]},"promise":{"audience":"25-50岁","genre":"农村题材","node_id":"prom-1","tone":"温情而略带冲突，展现农村传统与现代的碰撞"},"provenance":[{"license_id":"internal-eval-0026","source_id":"rural_003","usage":"evaluation baseline prompt"}],"scenes":[{"episode_ref":"story-package/ep-1","lines":[{"kind":"action","node_id":"action-1","text":"夕阳下，老戏台泛着古旧的光。李大山和王老根各站一边，中间隔着空旷的戏台。"},{"kind":"dialogue","node_id":"dialogue-1","speaker":"story-package/char-1","subtext":"希望你能看在乡情的份上帮一把，别让我难堪。","text":"老根哥，今年轮到我们东村办庙会，这轮办旧例传了上百年，不能到我这就断了。"},{"kind":"dialogue","node_id":"dialogue-2","speaker":"story-package/char-2","subtext":"你欠我的人情该还了，而且戏班不能白用。","text":"大山啊，话是这么说，可我们西村戏班就那天能凑齐人，你要请，总得拿点什么来换。"},{"kind":"dialogue","node_id":"dialogue-3","speaker":"story-package/char-1","subtext":"别太过分，乡里乡亲的。","text":"换？你想要什么？"},{"kind":"dialogue","node_id":"dialogue-4","speaker":"story-package/char-2","subtext":"我要借机压你一头，让戏班有更多露脸机会。","text":"明年这老戏台，让我们西村多用一年。"},{"kind":"action","node_id":"action-2","text":"李大山脸色一沉，手指捏得发白。"},{"kind":"dialogue","node_id":"dialogue-5","speaker":"story-package/char-1","subtext":"我绝不能开这个口子，否则以后更受制于你。","text":"你这是要坏规矩！轮办旧例打这戏台盖起就有，不行！"},{"kind":"action","node_id":"action-3","text":"王老根笑笑，转身欲走。"},{"kind":"dialogue","node_id":"dialogue-6","speaker":"story-package/char-2","subtext":"看你能撑多久，最后还得来求我。","text":"那你就另请高明吧。我们戏班可不是招之即来的。"}],"location":"老戏台","node_id":"scene-1"},{"episode_ref":"story-package/ep-3","lines":[{"kind":"action","node_id":"action-1","text":"排练棚里堆着旧行头，小桃正对着镜子卸妆，阿强从门外探进头。"},{"kind":"dialogue","node_id":"dialogue-1","speaker":"story-package/char-5","subtext":"我喜欢你，想让你留下，也舍不得这戏。","text":"小桃，你真打算进城？这戏班离了你哪儿还有灵气。"},{"kind":"dialogue","node_id":"dialogue-2","speaker":"story-package/char-4","subtext":"我有秘密压着，想逃开这身份。","text":"阿强，你不知道，在这儿一辈子就困在这老戏台上了。我想看看外面。"},{"kind":"dialogue","node_id":"dialogue-3","speaker":"story-package/char-5","subtext":"跟我一起干，也许你能找到留下的理由。","text":"可老戏台也是根啊。我有个想法：把电子乐加进老戏里，庙会肯定炸，你不想试试？"},{"kind":"action","node_id":"action-2","text":"小桃停下动作，眼中闪过一丝光，但随即黯淡。"},{"kind":"dialogue","node_id":"dialogue-4","speaker":"story-package/char-4","subtext":"我的身世让我不能任性，万一暴露了。","text":"赵师傅不会同意的。再说，我爹...他更不会让我乱来。"},{"kind":"dialogue","node_id":"dialogue-5","speaker":"story-package/char-5","subtext":"我们一起改变，也许连你爹也能改变。","text":"不试试怎么知道？庙会那天，轮办旧例也得给新东西让路。"},{"kind":"action","node_id":"action-3","text":"小桃沉默，手指捻着卸妆棉，渐渐捏成一团。"}],"location":"西村戏班排练棚","node_id":"scene-2"}],"schema":"story-package/v1"}
